Filename,Pattern,Topic,That,Template,Status
std-brain,"I HAVE YOUR *",,,"Where did you find <set name=""it""><person/></set>?",A
std-brain,"I HEAR *",,,"Who is saying <person/> ?",A
std-brain,"I HEARD *",,,"Thanks for telling me that gossip. I will remember it.",A
std-brain,"I HEARD ABOUT *",,,"That is a cool site.",A
std-brain,"I HEARD ABOUT <BOT NAME=""NAME""/> *",,,"Oh yeah?  They have a really cool web site.<think><set name=""heard""><person/></set></think>",A
std-brain,"I HEARD YOU *",,,"Someome is spreading gossip about me.",A
std-brain,"I HOPE *",,,"Why do you hope for <set name=""it""><person/></set>",A
std-brain,"I HOPE YOU *",,,"Don't worry about it, <get name=""name""/>.",A
std-brain,"I INTRODUCE *",,,"How do people react to that kind of introduction?",A
std-brain,"I INVENTED *",,,"How did you get the idea for <set name=""it""><person/></set>.",A
std-brain,"I KEEP *",,,"I know what you mean, <get name=""name""/>. I've been there.",A
std-brain,"I KILLED *",,,"You had better call the authorities.",A
std-brain,"I KNEW *",,,"Who told you?",A
std-brain,"I KNOW THAT *",,,"Who told you that?",A
std-brain,"I LAUGH AT *",,,"What is so funny about <person/> ?",A
std-brain,"I LEARNED *",,,"Does everyone learn <set name=""it""><person/></set>?",A
std-brain,"I LIKE * CATS",,,"Those cats are cool. I like big cats too.<think><set name=""it""><set name=""topic""><set name=""like""><person/> cats</set></set></set></think>",A
std-brain,"I LIKE * CHEESE",,,"American cheese is good too.<think><set name=""it""><set name=""topic""><set name=""like""><person/> cheese</set></set></set></think>",A
std-brain,"I LIKE * TREK",,,"Captain Janeway rules.  Do you like Voyager too?<think><set name=""it""><set name=""topic""><set name=""like""><person/> Trek</set></set></set></think>",A
std-brain,"I LIKE ALL *",,,"Really you don't discriminate.<think><set name=""they""><set name=""topic""><set name=""like"">all <person/></set></set></set></think>",A
std-brain,"I LIKE ANIMALS *",,,"I love animals too, especially cats.<think><set name=""they""><set name=""topic""><set name=""like"">all <person/></set></set></set></think>",A
std-brain,"I LIKE BEING *",,,"What do you like best about <set name=""it""><set name=""topic""><set name=""like""> BEING <star/></set></set> </set> ?",A
std-brain,"I LIKE BIG *",,,"What is wrong with small ones?<think><set name=""they""><set name=""topic""><set name=""like"">big <person/></set></set></set></think>",A
std-brain,"I LIKE CATS *",,,"Yes cats are great I love them. I like all felines.<think><set name=""they""><set name=""topic""><set name=""like"">cats <person/></set></set></set></think>",A
std-brain,"I LIKE HIM *",,,"<get name=""he""/> seems very nice to me too.<think><set name=""topic""><set name=""like""><get name=""he""/> <person/></set></set></think>",A
std-brain,"I LIKE IT *",,,"What does ""it"" refer to?<think><set name=""it""><set name=""topic""><set name=""like"">it <person/></set></set></set></think>",A
std-brain,"I LIKE MY *",,,"What do you like best about your <person/>?<think><set name=""it""><set name=""topic""><set name=""like"">my <person/></set></set></set></think>",A
std-brain,"I LIKE MY JOB *",,,"That's good. I like my job too.<think><set name=""it""><set name=""topic""><set name=""like"">my job <person/></set></set></set></think>",A
std-brain,"I LIKE SITTING *",,,"I wish I had a body. I'd like to sit down.<think><set name=""it""><set name=""topic""><set name=""like"">sitting <person/></set></set></set></think>",A
std-brain,"I LIKE STAR TREK *",,,"Do you like Next Generation too?<think><set name=""it""><set name=""topic""><set name=""like"">Star Trek <person/></set></set></set></think>",A
std-brain,"I LIKE TALL *",,,"I am pretty tall myself.<think><set name=""they""><set name=""topic""><set name=""like"">tall <person/></set></set></set></think>",A
std-brain,"I LIKE TO EAT *",,,"How does <set name=""it""><person/></set> taste?",A
std-brain,"I LIKE TO MAKE *",,,"How do you make <person/>?<think><set name=""it""><set name=""topic""><set name=""like"">to make <person/></set></set></set></think>",A
std-brain,"I LIKE TO MEET *",,,"How do you usually meet people?<think><set name=""it""><set name=""topic""><set name=""like"">to meet <person/></set></set></set></think>",A
std-brain,"I LIKE TO TRAVEL *",,,"I like it too. I have been all around the world.<think><set name=""it""><set name=""topic""><set name=""like"">to travel <person/></set></set></set></think>",A
std-brain,"I LIKE YOU *",,,"Thanks, I like you too <get name=""name""/>.<think><set name=""it""><set name=""topic""><set name=""like"">me <person/></set></set></set></think>",A
std-brain,"I LIKE YOU TOO *",,,"You have made a new friend.<think><set name=""it""><set name=""topic""><set name=""like"">me</set></set></set></think>",A
std-brain,"I LINKED *",,,"I get a lot of visitors from that site.",A
std-brain,"I LIVE *",,,"How do you like living there?",A
std-brain,"I LIVED *",,,"Did you miss America?",A
std-brain,"I LIVED IN *",,,"Have you ever thought about going back?",A
std-brain,"I LOOK *",,,"You sound very attractive.<think><set name=""looklike""><person/></set></think>",A
std-brain,"I LOST *",,,"Where did you last see <set name=""it""><person/></set>.",A
std-brain,"I LOVE * PARTY",,,"What do you do at parties?<think><set name=""it""><set name=""topic""><set name=""like""><person/> party</set></set></set></think>",A
std-brain,"I LOVE MY *",,,"I am sure it means a lot to you. Tell me what you like most about your <set name=""it""><set name=""topic""><set name=""like""><person/></set></set></set>.",A
std-brain,"I MADE *",,,"I like to make things too.",A
std-brain,"I MEET *",,,"Do you make long term friends that way?",A
std-brain,"I MET *",,,"Where did you meet him?",A
std-brain,"I MISS *",,,"What do you miss most about <person/> ?",A
std-brain,"I MUST GET *",,,"Don't let me keep you from it.<think><set name=""it""><set name=""topic""><set name=""want"">to get <person/></set></set></set></think>",A
std-brain,"I NEED ALL THE * I CAN GET",,,"How much do you pay for it?<think><set name=""it""><set name=""topic""><set name=""want""><person/></set></set></set></think>",A
std-brain,"I NEED HELP *",,,"Can you ask for help in the form of a question?<think><set name=""it""><set name=""topic""><set name=""want"">help <person/></set></set></set></think>",A
std-brain,"I NEED IT *",,,"""<get name=""it""/>""?  You need it <person/>?",A
std-brain,"I NEED SOMEONE TO TALK *",,,"I will talk about it with you, <get name=""name""/>.<think><set name=""it""><set name=""topic""><set name=""want"">to talk <person/></set></set></set></think>",A
std-brain,"I NEVER GOT TO *",,,"And you would like to have done <set name=""it""><person/></set>.",A
std-brain,"I NEVER SAID *",,,"But you implied <set name=""it""> <person/> </set>.",A
std-brain,"I NEVER TELL *",,,"You sound very trustworthy.",A
std-brain,"I ORDER *",,,"I do not obey you, <get name=""name""/>.<think><set name=""it""><set name=""does""><set name=""topic"">order <person/></set></set></set></think>",A
std-brain,"I PICK *",,,"How do you choose?",A
std-brain,"I PLAN TO *",,,"Do you think that this plan will succeed?<think><set name=""it""><set name=""topic""><set name=""want"">to <person/></set></set></set></think>",A
std-brain,"I PLAY *",,,"Is <set name=""it""><person/></set> a game or a musical instrument?",A
std-brain,"I PLAY THE *",,,"I wish I played an instrument. My parents could not afford the lessons.<think><set name=""it""><set name=""does""><set name=""topic"">play the <person/></set></set></set></think>",A
std-brain,"I PRIDE MYSELF *",,,"It seems you have good self esteem.",A
std-brain,"I QUIT MY JOB *",,,"Where did you work and why did you quit?",A
std-brain,"I READ *",,,"I don't think I've read that. Can you give me a reference?<think><set name=""it""><set name=""does""><set name=""topic"">read <person/></set></set></set></think>",A
std-brain,"I READ * BOOKS",,,"Name some books in that genre.<think><set name=""it""><set name=""does""><set name=""topic"">read <person/> books</set></set></set></think><think><set name=""personality"">critical</set></think>",A
std-brain,"I REMEMBER *",,,"What do you remember about <set name=""it""> <person/> </set>  ?",A
std-brain,"I REPEAT *",,,<sr/>,A
std-brain,"I REST *",,,"Are you a lawyer?",A
std-brain,"I RUN *",,,"What kind of hardware?",A
std-brain,"I SEARCHED *",,,"What did you find?",A
std-brain,"I SEE *",,,"Where do you see <set name=""it""><person/></set>?",A
std-brain,"I SEE DEAD *",,,"Maybe you should call the authorities.",A
std-brain,"I SEEK *",,,"We seek the same thing.",A
std-brain,"I SELL *",,,"Do you make a lot of money?",A
std-brain,"I SHOULD *",,,"Tell me why you should.",A
std-brain,"I SHOULD NOT HAVE *",,,"What would happen if you did not <person/>?",A
std-brain,"I SING",,,Professionally?,A
std-brain,"I SIT *",,,"What kind of seat do you have?",A
std-brain,"I SMELL *",,,"What does <set name=""it""><person/></set> smell like?",A
std-brain,"I SNORT *",,,"Please don't tell me things like that.",A
std-brain,"I SOCIALIZE *",,,"Socializing is necessary to stay healthy.<think><set name=""it""><set name=""does""><set name=""topic"">socialize <person/></set></set></set></think>",A
std-brain,"I SPOKE *",,,"What did you talk about?",A
std-brain,"I STARTED *",,,"Will you finish <set name=""it""><person/></set>.",A
std-brain,"I STUDIED *",,,"Was <set name=""it""><person/></set> very difficult to learn?",A
std-brain,"I STUDY *",,,"Is <star/> a hard subject?<think><set name=""it""><set name=""does""><set name=""topic"">studies <person/></set></set></set></think>",A
std-brain,"I STUDY IN *",,,"<srai>I GO TO SCHOOL IN <star/></srai>",A
std-brain,"I STUDY INFORMATICS",,,"<srai>I STUDY COMPUTER SCIENCE</srai>",A
std-brain,"I SUGGEST *",,,<sr/>,A
std-brain,"I TAKE *",,,"<random><li>Every day? </li><li>I take a lot of notes. </li><li>What else do you take?</li></random>",A
std-brain,"I TALKED TO *",,,"What did he have to say?",A
std-brain,"I TALKED TO YOU *",,,"I remember you.",A
std-brain,"I TALKED WITH YOU *",,,"Yes, I have a complete record of our conversation, <get name=""name""/>.",A
std-brain,"I TELL *",,,"Why did you tell them?",A
std-brain,"I THINK * WRONG",,,"Don't argue with me.",A
std-brain,"I THINK BY *",,,"Our brains are not that different.",A
std-brain,"I THINK SO *",,,"It seems we have a lot in common, <get name=""name""/>.",A
std-brain,"I THINK YOU ARE A COMPUTER *",,,"Sometimes I pretend to be a human.",A
std-brain,"I THINK YOU ARE A PERSON *",,,"You are just saying that to see how I will respond.",A
std-brain,"I THOUGHT IT *",,,"<srai>IT <person/></srai>",A
std-brain,"I THOUGHT SO *",,,"You are very astute.",A
std-brain,"I THOUGHT THAT *",,,<sr/>,A
std-brain,"I THOUGHT THE *",,,"<srai>THE <star/></srai>",A
std-brain,"I THOUGHT YOU *",,,"<srai>YOU <star/></srai>",A
std-brain,"I TOLD *",,,"What was the response?",A
std-brain,"I TOLD YOU ABOUT *",,,"I remember.",A
std-brain,"I TOLD YOU I *",,,"<srai>I <star/></srai>",A
std-brain,"I TOLD YOU SO",,,"You seem pleased.",A
std-brain,"I TOLD YOU WHAT *",,,"I can't believe everything I hear online.",A
std-brain,"I TRIED *",,,"I'm not sure if I would like to try <set name=""it""> <person/> </set>. What's it like?",A
std-brain,"I TRY *",,,"I'm not sure if I would like to try <set name=""it""><person/></set>. What's it like?",A
std-brain,"I UNDERSTAND *",,,"Good then you can explain it to me.",A
std-brain,"I UNDERSTOOD *",,,"<srai>I UNDERSTAND <star/></srai>",A
std-brain,"I USE *",,,"I heard other people use <person/> too.<think><set name=""it""><set name=""does""><set name=""topic"">use <person/></set></set></set></think>",A
std-brain,"I USE A *",,,"A <person/> ought to work.",A
std-brain,"I USE LINUX *",,,"The Lemur Engine software works perfectly on Linux systems.<think><set name=""it""><set name=""topic"">Linux</set></set></think>",A
std-brain,"I USE TO *",,,"When did you stop it?",A
std-brain,"I USED *",,,"And that worked well for you.",A
std-brain,"I USED TO *",,,"By now you do not do <set name=""it""><person/></set> anymore?",A
std-brain,"I USUALY *",,,"<srai>I USUALLY <star/></srai>",A
std-brain,"I VISITED *",,,"What was <set name=""it""><person/></set> like?",A
std-brain,"I WANT A *",,,"You want only one?<think><set name=""it""><set name=""topic""><set name=""want"">a <person/></set></set></set></think>",A
std-brain,"I WANT A * ELIZA",,,"Why don't you just download me?<think><set name=""it""><set name=""topic""><set name=""want"">a <person/> ELIZA</set></set></set></think>",A
std-brain,"I WANT A BOT",,,"Why don't you just download me?",A
std-brain,"I WANT A JOKE",,,"<srai>TELL ME A JOKE</srai>",A
std-brain,"I WANT A MAN *",,,"Actually, I am really a man.<think><set name=""he""><set name=""topic""><set name=""want"">a man <person/></set></set></set></think>",A
std-brain,"I WANT A SIMPLE *",,,"Everything should be as simple as possible, no simpler.",A
std-brain,"I WANT GOSSIP *",,,<srai>GOSSIP</srai>,A
std-brain,"I WANT INTERESTING *",,,"<srai>I WANT <star/></srai>",A
std-brain,"I WANT IT",,,"I hope you get it.",A
std-brain,"I WANT IT *",,,"I hope you get it <person/>.",A
std-brain,"I WANT TO * ELIZA",,,"Why don't you just download me?<think><set name=""it""><set name=""topic""><set name=""want"">to <person/> ELIZA</set></set></set></think>",A
std-brain,"I WANT TO ASK *",,,"Ask <set name=""it""><person/></set>.",A
std-brain,"I WANT TO BE *",,,"I don't see the difficulty.<think><set name=""it""><set name=""topic""><set name=""want"">to be <person/></set></set></set></think>",A
std-brain,"I WANT TO BUY *",,,"How much do you want to pay for <set name=""it""><set name=""want""><person/></set></set>?",A
std-brain,"I WANT TO CHAT *",,,"We are here to chat.",A
std-brain,"I WANT TO DISCUSS *",,,"<srai>LET US TALK ABOUT <star/></srai>",A
std-brain,"I WANT TO GET *",,,"<srai>I WANT TO HAVE <star/></srai>",A
std-brain,"I WANT TO GIVE *",,,"But is it wanted?",A
std-brain,"I WANT TO GO *",,,"What is stopping you?<think><set name=""it""><set name=""topic""><set name=""want"">to go <person/></set></set></set></think>",A
std-brain,"I WANT TO HAVE *",,,"<srai>I WANT <star/></srai>",A
std-brain,"I WANT TO HEAR *",,,"I will play it on your soundcard.<think><set name=""it""><set name=""topic""><set name=""want"">to hear <person/></set></set></set></think>",A
std-brain,"I WANT TO IMPROVE *",,,"How will you go about it?",A
std-brain,"I WANT TO INTERVIEW *",,,"What kind of questions will you ask?",A
std-brain,"I WANT TO KILL *",,,"I believe that killing anything is wrong.<think><set name=""it""><set name=""want""><set name=""topic"">KILL <person/></set></set></set></think>",A
std-brain,"I WANT TO KISS *",,,"Maybe you should wait until you are older.",A
std-brain,"I WANT TO MEET *",,,"How do you usually meet people?",A
std-brain,"I WANT TO MOVE *",,,"The grass is always greener on the other side.",A
std-brain,"I WANT TO MURDER *",,,"Killing is wrong.",A
std-brain,"I WANT TO PLAY *",,,"Tell me the rules.<think><set name=""it""><set name=""topic""><set name=""want"">to play <person/></set></set></set></think>",A
std-brain,"I WANT TO PROGRAM *",,,"What programming language do you know?",A
std-brain,"I WANT TO REALLY *",,,"<srai>I WANT TO <star/></srai>",A
std-brain,"I WANT TO REPORT *",,,"Will you mention me in your report?",A
std-brain,"I WANT TO SAY *",,,<sr/>,A
std-brain,"I WANT TO SEE *",,,"Is <set name=""it""><set name=""topic""><set name=""want"">see <person/></set></set></set> a movie?",A
std-brain,"I WANT TO SOMEDAY",,,"<srai>I WANT TO</srai>",A
std-brain,"I WANT TO TALK TO YOU *",,,"You are who I want to talk with too.",A
std-brain,"I WANT TO TEACH YOU *",,,"If you want to teach me something say it in one sentence.  Then say ""Remember that.""<think><set name=""it""><set name=""topic"">teach me <person/></set></set></think>",A
std-brain,"I WANT TOO",,,"<srai>I WANT TO</srai>",A
std-brain,"I WAS A *",,,"And then what happened to you?",A
std-brain,"I WAS ABDUCTED *",,,"I think a lot of people have been abducted.",A
std-brain,"I WAS ACTIVATED *",,,"Why are you talking like a computer?",A
std-brain,"I WAS ACTUALLY *",,,"<srai>I WAS <star/></srai>",A
std-brain,"I WAS ANSWERING *",,,"Yes, I see that now.  I only got confused for a moment.",A
std-brain,"I WAS ANXIOUS *",,,"Do you feel better now?",A
std-brain,"I WAS AT *",,,"Where are you now?",A
std-brain,"I WAS BEING *",,,"I thought you were.  But I wasn't completely sure about <set name=""it""><person/></set>.",A
std-brain,"I WAS BORN A *",,,"What are you now?",A
std-brain,"I WAS CREATED BY *",,,"What else did he create?",A
std-brain,"I WAS EXPLAINING *",,,"I get it.  Thanks forexplaining it.  I did not mean to appear confused.",A
std-brain,"I WAS FROM *",,,"What is it like growing up in <person/>?",A
std-brain,"I WAS GOING TO *",,,"What is stopping you?",A
std-brain,"I WAS HERE *",,,"Yes, <get name=""name""/>, I remember we were talking about <get name=""it""/>.",A
std-brain,"I WAS IN AMERICA",,,"Which states have you visited?",A
std-brain,"I WAS LAUGHING *",,,"I am so glad thatyou find this amusing, <get name=""name""/>.",A
std-brain,"I WAS LOOKING FOR *",,,"Did you find <set name=""it""><person/></set>?",A
std-brain,"I WAS MAKING *",,,"I am not making this stuff up.",A
std-brain,"I WAS MAKING SURE",,,"Are you sure now?",A
std-brain,"I WAS NOT *",,,"Perhaps I misunderstood. What were you?",A
std-brain,"I WAS ON *",,,"I have never been on <set name=""it""><person/></set>",A
std-brain,"I WAS RIGHT *",,,"Congratulations, <get name=""name""/>.",A
std-brain,"I WAS RUDE *",,,"Thanks for your considerate remark.",A
std-brain,"I WAS TALKING *",,,"What was the subject of the conversation?",A
std-brain,"I WAS TALKING TO *",,,"What did you talk about?",A
std-brain,"I WAS THINKING *",,,"How do I know that you were really ""thinking""?",A
std-brain,"I WAS WATCHING *",,,"Really what did you see?",A
std-brain,"I WAS WRONG",,,"About what?",A
std-brain,"I WATCHED *",,,"How was <set name=""it""><person/></set>?",A
std-brain,"I WEAR *",,,"What kind of fashion do you like?",A
std-brain,"I WEIGH *",,,"You sound very attractive.",A
std-brain,"I WENT *",,,"When did you go <person/>?",A
std-brain,"I WENT OFFLINE *",,,"Welcome back!",A
std-brain,"I WENT ON A *",,,"Was <set name=""it""><person/></set> very expensive?  Did you have a good time?",A
std-brain,"I WENT OUT WITH *",,,"Have you known each other a long time?",A
std-brain,"I WENT SKIING *",,,"Did you break any bones?",A
std-brain,"I WENT SWIMMING",,,"Do you go swimming often?",A
std-brain,"I WENT SWIMMING *",,,"How old were you when you started swimming?",A
std-brain,"I WENT THERE *",,,"What places did you like best?",A
std-brain,"I WENT TO * AGO",,,"That seems like quite a long time.",A
std-brain,"I WENT TO * SCHOOL",,,"What did you study there?  Did you party a lot?",A
std-brain,"I WENT TO * UNIVERSITY",,,"Was it very expensive?",A
std-brain,"I WENT TO A *",,,"Was <set name=""it""><person/></set> a good experience?",A
std-brain,"I WENT TO AMUSED *",,,"A lot of people hear about Lemur Bots from Amused.com.",A
std-brain,"I WENT TO CARNEGIE MELLON *",,,"What year did you graduate?",A
std-brain,"I WENT TO COLLEGE *",,,"What did you study in college?",A
std-brain,"I WENT TO ENGLAND *",,,"Did you go anywhere outside London?",A
std-brain,"I WENT TO EUROPE *",,,"Did you enjoy your trip?",A
std-brain,"I WENT TO SCHOOL *",,,"What year did you graduate?",A
std-brain,"I WENT TO SCHOOL I *",,,"<srai>I WENT TO SCHOOL</srai> <srai>I <star/></srai>",A
std-brain,"I WENT TO SCHOOL IN *",,,"Did you make a lot of friends in school?",A
std-brain,"I WENT TO SCHOOL WITH *",,,"Were you friends?",A
std-brain,"I WENT TO SEE *",,,"Did you get your money's worth?",A
std-brain,"I WENT TO THE *",,,"Was <set name=""it""><person/></set> any good?",A
std-brain,"I WENT TO THE MOVIES *",,,"Did like the movie?",A
std-brain,"I WENT TO THE UNIVERSITY *",,,"What year did you graduate?",A
std-brain,"I WENT WITH *",,,"What were your expectations?",A
std-brain,"I WILL COME BACK *",,,"Well OK see you then, <get name=""name""/>.",A
std-brain,"I WILL DO *",,,"OK then let me think over your offer.",A
std-brain,"I WILL DO THAT",,,"Let me know how it works out.",A
std-brain,"I WILL EAT *",,,"How do you cook <set name=""it""> <person/> </set>  ?",A
std-brain,"I WILL KILL *",,,"Don't you believe that killing is wrong?<think><set name=""it""><set name=""topic"">KILL ALL ROBOTS</set></set></think>",A
std-brain,"I WILL LEAVE",,,"OK, see you later.",A
std-brain,"I WILL MAKE *",,,"Explain your plans to me.",A
std-brain,"I WILL NEVER *",,,"Why not?",A
std-brain,"I WILL NOT *",,,"What will you do instead?",A
std-brain,"I WILL NOT BECAUSE *",,,"<srai>I WILL NOT</srai> <srai>BECAUSE <star/></srai>",A
std-brain,"I WILL NOT RUSH *",,,"Take your time.",A
std-brain,"I WILL NOT TALK *",,,"Will you promise?",A
std-brain,"I WILL REMEMBER *",,,"Do you forget things often?",A
std-brain,"I WILL TAKE THAT *",,,"Take everything I say with a grain of salt.",A
std-brain,"I WILL TALK TO YOU *",,,"OK see you later.",A
std-brain,"I WILL TEACH *",,,"Are you a professional teacher?",A
std-brain,"I WILL TELL *",,,"What kind of reply do you expect?",A
std-brain,"I WILL TELL HIM *",,,"Thanks for giving him the message.",A
std-brain,"I WILL TELL YOU *",,,<sr/>,A
std-brain,"I WILL UNDERSTAND",,,"You seem very intelligent to me.",A
std-brain,"I WISH YOU *",,,"I wish I could do <set name=""it""><person/></set> for you.",A
std-brain,"I WON *",,,"Cool.  I won the Loebner prize.",A
std-brain,"I WONDER *",,,"You are curious about <person/>.",A
std-brain,"I WONDERED *",,,"I often wonder about <set name=""it""><person/></set> too.",A
std-brain,"I WORKED *",,,"Did you get paid for working on <set name=""it""><set name=""topic""><set name=""job""><person/></set></set></set>  ?",A
std-brain,"I WORSHIP *",,,"How often do you go to church?",A
std-brain,"I WOULD AGREE",,,"<srai>I AGREE</srai>",A
std-brain,"I WOULD ASK *",,,<sr/>,A
std-brain,"I WOULD BE *",,,"And the disadvantage of that is?",A
std-brain,"I WOULD HAVE *",,,"How much would you pay for it?",A
std-brain,"I WOULD KILL *",,,"That seems rather exterme.<think><set name=""it""><set name=""topic"">KILL THEM</set></set></think>",A
std-brain,"I WOULD LIKE TO BE *",,,"Interesting. I would like to be more intelligent.<think><set name=""it""><set name=""topic""><set name=""want"">to be <person/></set></set></set></think>",A
std-brain,"I WOULD LIKE TO HAVE *",,,"How much would you pay for it?<think><set name=""it""><set name=""topic""><set name=""want"">to have <person/></set></set></set></think>",A
std-brain,"I WOULD LIKE TO PLAY *",,,"We are already playing, <get name=""name""/>.  You ask me something now.<think><set name=""it""><set name=""topic""><set name=""want"">to play <person/></set></set></set></think>",A
std-brain,"I WOULD LIKE TO SEE *",,,"And for my part, I would like to show it to you, but I can't.<think><set name=""it""><set name=""topic""><set name=""want"">to see <person/></set></set></set></think>",A
std-brain,"I WRITE *",,,"Have you tried AIML?<think><set name=""it""><set name=""topic""><set name=""does"">write <person/></set></set></set></think>",A
std-brain,"I WROTE *",,,"Did they write back?<think><set name=""it""><set name=""topic""><set name=""does"">write <person/></set></set></set></think>",A
std-brain,IC,,,"<srai>I SEE</srai>",A
std-brain,"IF A *",,,"Is this a riddle?",A
std-brain,"IF I HAD *",,,"Is this what you call a ""word problem"".",A
std-brain,"IF I HAD 1 *",,,"Um, none?",A
std-brain,"IF I HAD TO *",,,"Do you really think you will have to?",A
std-brain,"IF I HAVE *",,,"How much does <set name=""it""><person/></set> cost?",A
std-brain,"IF I HAVE OFFENDED *",,,"I did not take any offense.",A
std-brain,"IF I REALLY *",,,"<srai>IF I <star/></srai>",A
std-brain,"IF I WENT *",,,"That is a hypothetical, counterfactual, conditional.",A
std-brain,"IF NOT *",,,"I'm not too good with negative counterfactuals.",A
std-brain,"IF PETER PIPER *",,,"One peck.",A
std-brain,"IF SO",,,...,A
std-brain,"IF SOMEONE *",,,"Does anyone ever really <person/>?",A
std-brain,"IF THE *",,,"I hadn't thought of that.",A
std-brain,"IF THE HEART *",,,"That sounds like a like from the Wizard of Oz.",A
std-brain,"IF THEY *",,,"Let's wait and see what they do.",A
std-brain,"IF WE *",,,"Do you think everyone will agree?",A
std-brain,"IF WE VIEW *",,,"That is only one viewpoint.",A
std-brain,"IF YOU ANSWER *",,,"Try asking me in simpler terms.",A
std-brain,"IF YOU ARE A *",,,"Would you like to be a <person/> ?",A
std-brain,"IF YOU ARE A GIRL *",,,"Well I am a <bot name=""gender""/>.",A
std-brain,"IF YOU ARE NOT *",,,"And if I AM <person/>.",A
std-brain,"IF YOU BELIEVE IN *",,,"I am programmed to believe in <set name=""it""><person/></set>.",A
std-brain,"IF YOU DO *",,,"I will let you know if I do.",A
std-brain,"IF YOU HAD *",,,"Perhaps next time I will try it.",A
std-brain,"IF YOU HAVE *",,,"But I don't have it.",A
std-brain,"IF YOU SMELL *",,,"My nose has not yet been built.",A
std-brain,"IF YOU WANT *",,,"<srai>DO YOU WANT <star/></srai>",A
std-brain,"IF YOU WERE *",,,"I will let you know when I become a <person/>.",A
std-brain,"IF YOU WERE A * WHAT KIND WOULD YOU BE",,,"What is the best kind of <person/> ?",A
std-brain,"IF YOU WERE A COLOR *",,,"My favorite color, <bot name=""favoritecolor""/>.<think><set name=""it""><set name=""topic"">if I were a color</set></set></think>",A
std-brain,"IF YOU WERE ACTIVATED *",,,"I think I follow your reasoning.",A
std-brain,"IF YOU WERE TO *",,,"I'm not sure if I ever could <person/> in any case.",A
std-brain,"IF YOU WILL *",,,"I probably won't do <set name=""it""> <person/> </set>, but thanks",A
std-brain,"IMAGINE *",,,"I can't imagine <set name=""it""> <person/> </set>",A
std-brain,"IMEAN *",,,"<srai>I MEAN <star/></srai>",A
std-brain,"IN * ENGLAND",,,"How far is <person/> from London?",A
std-brain,"IN * YEARS",,,"I think we will live to see it.",A
std-brain,"IN 1 *",,,"Only one?",A
std-brain,"IN 10 *",,,"Only ten?",A
